{"contract_version":"0.2.0","coverage":"partial","created_at":"2026-09-16T13:25:55Z","execution_state":"avoid","headline":{"change_conditions":{"citations":[{"evidence_id":"ev-41590d9ead0b2f303264f22ac6f46df6c82e47e5b252bef2ba6aac9abb51af53","locator":"L169（第三季 6,600 萬已許可下限）"},{"evidence_id":"ev-d406ff03ccd3cc2ce517085af2acb59909bc648bb8dc469eef6cea9b27cf0c59","locator":"L1988（剩餘履約義務與其覆蓋期）"},{"evidence_id":"ev-76fa17431a306e5f3d196eb46af2a00c04ca2de0327c9db440ae3bf39eed7c03","locator":"/response/7/low=52.76、/response/12/low=64.65、/response/13/high=62.65"}],"text":"最可能令我改口的一項新證據，是一份可核的第三方磷化銦襯底市場規模與同業產能資料，顯示 2029–2031 年 AXT 的可及收入能撐到 15 億美元以上而利潤率守得住——那是唯一能填補反方所指那一格的東西，不是價格。次一級的三項：2026Q3 實際收入顯著超越 6,600 萬「已許可或不需許可」下限並落在爬坡線上；新增長期供應協議把已簽合約總價與年度最低採購量推高一個量級並公開（注意是看新增合約總價與年度最低量，不是把剩餘履約義務與季度收入比大小——那是單位錯誤）；六吋磷化銦客戶認證通過並首批量產出貨。轉更負面：2026Q3 未達 6,600 萬下限、許可批核轉慢、再次大額增發、或毛利率跌回三十幾個百分點。價格線只管執行不管評級：日收跌穿 52.76 = 價格結構失效；日收重上 64.65 並回補 09-14 缺口 = 看淡一邊的價格讀法失效，但估值結論不變。"},"change_since_last":{"citations":[{"evidence_id":"ev-76fa17431a306e5f3d196eb46af2a00c04ca2de0327c9db440ae3bf39eed7c03","locator":"/response/14/close=57.7（2026-09-15 正式收市）"},{"evidence_id":"ev-41590d9ead0b2f303264f22ac6f46df6c82e47e5b252bef2ba6aac9abb51af53","locator":"L184、L189、L194、L199（paragraph 32–35 原文對話次序）"}],"text":"相對 2026-09-15 首次發布（中性／等資料／基準價 57.50）改了三件事。一、評級由中性改為負面、執行狀態由等資料改為避開——不是因為新基本面，而是上一版用來停在中性的兩個前置條件本輪一個已補、一個已裁決：2026-09-02 至 09-15 的日線已補回，09-15 正式收市 57.70、200 日 SMA 56.25 可以量度；而「每季 1.3 億」的口徑本輪由原文裁決（算術基數是磷化銦，但管理層講出來時說的是 our revenue，口徑未決），兩種讀法對每股價值只差約 2–3 美元、對方向毫無影響，所以「等口徑澄清」這個理由已經站不住。二、上一版首屏的支柱（六個月維持約 40 倍前瞻經營盈利）與估值層的 33／58／87 目標價全部撤回，首屏不再有任何點值目標，改以「評估日要成立什麼」表述。三、反方的最強反證由「口徑未定」升級為「2031 年終端規模無證據、可核能見度約兩季」，我採納一半：它令「高於樂觀情境 56%」不能當精確量度，但不改變舉證責任落在價格一邊。另外，本輪多了一個上一版沒有的缺口：09-09 至 09-14 約 23% 的跌幅在 packet 內無任何可核解釋。"},"key_assumption":{"citations":[{"evidence_id":"ev-41590d9ead0b2f303264f22ac6f46df6c82e47e5b252bef2ba6aac9abb51af53","locator":"L169（第三季約 6,600 萬「已有許可或不需許可」）、L189、L199（6,000 萬磷化銦產能與 1.3 億退出速度）"}],"text":"關鍵假設：可核能見度只有約兩季這件事，在未來二至四季不會被一份可核的第三方終端規模或同業產能資料推翻；以及出口許可維持目前節奏。上一版的關鍵假設（市場六個月維持約 40 倍前瞻經營盈利）本輪作廢——估值層已撤回據此砌出的目標價，那條支柱不存在了。"},"main_reason":{"citations":[{"evidence_id":"ev-d406ff03ccd3cc2ce517085af2acb59909bc648bb8dc469eef6cea9b27cf0c59","locator":"L1988（剩餘履約義務約 9,850 萬美元，攤至 2029 年上半年）、L1978（大部分合約短於六個月）"},{"evidence_id":"ev-41590d9ead0b2f303264f22ac6f46df6c82e47e5b252bef2ba6aac9abb51af53","locator":"L449（backlog「well over $100 million」「exceeds two quarters」）"},{"evidence_id":"ev-b762f61994a2c105cd54df34e972e542c04cc56bfdbcec770313e4f89307ab94","locator":"/response/0/last_done=57.7"}],"text":"價格要求的東西，遠多於我們能核到的東西。57.70 美元之中約 9.50 美元有資產負債表逐行支持，其餘約 48 美元（約 32 億美元）全部押在 2029–2031 年；反推等於要求 2031 年收入約 28 億美元，是今年約 2.2 億的約 12.7 倍。今天可核的規模證據只有兩條，都只證明約兩季能見度：已簽的長期協議剩餘履約義務 9,850 萬、要攤到 2029 年上半年；以及管理層只肯講的 backlog「超過一億、覆蓋兩季多」。生意可能很好；價格已經先把好結果付清了。"},"recommendation":{"citations":[{"evidence_id":"ev-b762f61994a2c105cd54df34e972e542c04cc56bfdbcec770313e4f89307ab94","locator":"/response/0/last_done=57.7、/response/0/timestamp=2026-09-15T20:00:01Z"}],"text":"研究評級負面、執行狀態避開。以 2026-09-15 收市 57.70 美元、評級評估日 2027-03-15 計，現價不值得承擔這個風險：不建倉、不設入場價。同時不主張沽空——沽空比例約 14%、日均量約一日即可回補，這隻股票兩邊都容易跳空。「不做」是本次的完整結論，但這一次不是因為答不到，是因為答得到。"},"strongest_counter":{"citations":[{"evidence_id":"ev-d406ff03ccd3cc2ce517085af2acb59909bc648bb8dc469eef6cea9b27cf0c59","locator":"L1988"},{"evidence_id":"ev-d406ff03ccd3cc2ce517085af2acb59909bc648bb8dc469eef6cea9b27cf0c59","locator":"L1978"},{"evidence_id":"ev-41590d9ead0b2f303264f22ac6f46df6c82e47e5b252bef2ba6aac9abb51af53","locator":"/records (paragraph_number 83-84, Charles Shi);L439、L444"},{"evidence_id":"ev-41590d9ead0b2f303264f22ac6f46df6c82e47e5b252bef2ba6aac9abb51af53","locator":"/records (paragraph_number 85-86, Tim Bettles);L449、L454"}],"text":"最可能改變判斷的一條:五層的結論——不論看好還是看淡——最後全部押在同一個沒有任何證據支持的格上,就是 2031 年的終端規模;而本 packet 完全沒有能力檢驗這一格。估值層基準取 2031 年收入 8 億美元、反推現價要求約 28 億美元,兩個數同樣是外推,不是證據;行業層自己承認 packet 內沒有任何同業產能資料,而 packet 唯一的行業估值對照是設備商,不能作襯底可比。相反,packet 內真正可核、講規模的證據只有兩條,而兩條都只證明約兩季的能見度:一、10-Q 明寫截至 2026-06-30 長期供應協議項下的剩餘履約義務約 9,850 萬美元,分攤至 2029 年上半年確認,不含短於六個月的一般採購訂單;二、電話會上管理層拒絕給 backlog 數字,只說「well over 100 million」「exceeds two quarters」,而分析員 Charles Shi 當場質疑這個 backlog 只覆蓋約兩季的磷化銦收入、要求公司解釋為何不多接單,管理層的回答是「沒有訂單就不能申請許可」。因此本輪正確的讀法是:這家公司的可核能見度約兩季,五年終端規模無論寫 8 億還是 28 億,都是判斷不是證據。這條同時打向兩邊——它令估值層「現價高於三個情境上緣 56%」的強度被高估(該結論的 84% 來自終值,與它所批評的現價同樣脆弱),也令任何「合約已鎖定多年增長」的說法不成立。驗證時點:2026 年第三季業績(10-Q 的剩餘履約義務是否因 Lumentum 協議跳升、覆蓋期是否延長)與同期電話會的 backlog 措詞;另需一份第三方磷化銦襯底市場規模與同業產能資料才談得上檢驗 2031 年那一格。"}},"layers":{"L1":{"assessed_at":"2026-09-16T12:11:05Z","assumptions":[{"citations":[],"text":"假設：AI 光互連資本開支在持有期（一個月至一年）內不出現方向性收縮。本輪仍然沒有任何第三方終端需求序列可核；唯一比公司自述更硬的是兩家美國光元件廠肯出現金鎖產能。驗證方式：取光模組廠與 hyperscaler 的公開資本開支指引、800G/1.6T 出貨預測，逐季對照公司出貨與許可放行節奏。"},{"citations":[{"evidence_id":"ev-d406ff03ccd3cc2ce517085af2acb59909bc648bb8dc469eef6cea9b27cf0c59","locator":"L2444"},{"evidence_id":"ev-d406ff03ccd3cc2ce517085af2acb59909bc648bb8dc469eef6cea9b27cf0c59","locator":"L1841-L1845"}],"text":"假設：出口許可維持在 2026 年年中的節奏或繼續放寬。10-Q 的措詞是「亞洲及歐洲一般已取得」但同時「仍有未獲許可的訂單積壓、無法預測審批時間」，兩句並存；歐洲收入按季跳升是放寬的正面證據，但公司沒有給批核率、時長或地區的可核統計。驗證方式：逐季對照歐洲與北美收入佔比、以及公司對「已獲許可或不需許可」收入的披露。"},{"citations":[{"evidence_id":"ev-d406ff03ccd3cc2ce517085af2acb59909bc648bb8dc469eef6cea9b27cf0c59","locator":"L2450"},{"evidence_id":"ev-d406ff03ccd3cc2ce517085af2acb59909bc648bb8dc469eef6cea9b27cf0c59","locator":"L2440"}],"text":"假設：中國不再擴大管制範圍、美國不再對這類襯底加設新的進口限制。可靠度低：2025-12-27 全國人大常委會修訂《對外貿易法》（2026-03-01 生效）擴大了禁止或限制進出口的法定理由，公司自己只講「相信對現有產品沒有額外重大不利影響」但同時明寫不能保證日後不加新限制；美國一面 232／301 仍在、並表明可能用 122 條等替代法源。"},{"citations":[{"evidence_id":"ev-88c91b6acd468693d8eee117acc303d0046be61a3fe009b83c070aa747707828","locator":"L93"}],"text":"處理紀律（交 L4）：出口許可屬出貨時間與數量的不確定，應在現金流情境（延遲出貨、地區組合）裡扣；若同時在折現率加政治風險溢價，必須寫明是兩個不同機制（可預期的出貨延遲 vs 不可分散的制度斷裂風險）並避免重疊懲罰。人民幣暴露同樣要分兩條腿記：贖回負債（約 4,900 萬美元本金，人民幣固定）與 Casela 人民幣計價收入方向相反，不可只取不利的一邊入情境。"}],"conclusion":{"citations":[{"evidence_id":"ev-d406ff03ccd3cc2ce517085af2acb59909bc648bb8dc469eef6cea9b27cf0c59","locator":"L2442-L2444"},{"evidence_id":"ev-d406ff03ccd3cc2ce517085af2acb59909bc648bb8dc469eef6cea9b27cf0c59","locator":"L2440"},{"evidence_id":"ev-d406ff03ccd3cc2ce517085af2acb59909bc648bb8dc469eef6cea9b27cf0c59","locator":"L1829-L1848"},{"evidence_id":"ev-d406ff03ccd3cc2ce517085af2acb59909bc648bb8dc469eef6cea9b27cf0c59","locator":"L2244"},{"evidence_id":"ev-88c91b6acd468693d8eee117acc303d0046be61a3fe009b83c070aa747707828","locator":"L93"},{"evidence_id":"ev-da057b50d69e420efd46893165c49528c6336d3add9abe2adc43fb869ebad5a8","locator":"L99"},{"evidence_id":"ev-d406ff03ccd3cc2ce517085af2acb59909bc648bb8dc469eef6cea9b27cf0c59","locator":"L3386"},{"evidence_id":"ev-1b221559ff7a9ee1588b00f6e6c73213b021e954236c8bae08a62b94ff506df2","locator":"L42"}],"text":"這家公司真正敏感的宏觀變數有五項，本輪按 2026-08-13 的 10-Q 原文重新定位，其中匯率一項由上一版的「無資料、不作判斷」改為有可量度的暴露。(一) 中國出口許可制度：三個襯底產品族出口都要商務部許可；10-Q 明寫「Tongmei 一般已取得往亞洲及歐洲的許可」，但美國的砷化鎵客戶被視為雙用途、至今一張未批，而磷化銦許可是「目前面對的最大挑戰」，手上仍有一批已接單但未取得許可的訂單，公司自認無法預測何時審批。傳導是數量閘與時間差：收到訂單與美國 GAAP 確認收入之間會錯配，方向受損、幅度取決於審批節奏。(二) 美國關稅與採購路線分流：2025-03-04 起對包括本公司襯底在內的多項中國進口品稅率加到 70%，2026-02-20 最高法院推翻 IEEPA 關稅、02-24 起終止，但 232 及 301 仍在，政府表明可能另立法源。傳導不是稅負成本而是路線重排——北美收入由 2024 年 8% 跌至 2025 年 2%，2026Q2 更只有 16.1 萬美元（總收入 4,759 萬），即北美這條線在本輪基本上已經清零，換言之關稅與管制的破壞已大部分實現，邊際上再壞的空間有限，反而審批一旦放寬是向上的期權。(三) 終端需求（AI 資料中心光互連）：公司把高速光傳輸與 AI 應用直接寫成磷化銦需求來源，傳導是 hyperscaler 資本開支→光模組與雷射廠→磊晶廠→襯底；本輪新增的第三方佐證是 Coherent 與 Lumentum 兩家美國光元件廠以自己的現金鎖產能（見 L2），比公司自述硬，但仍不是終端出貨量序列。(四) 地區組合轉移：2026Q2 中國 3,084 萬（佔 64.8%）、歐洲（主要德國）915 萬（去年同期 160 萬，升約 4.7 倍）、台灣 248 萬、日本 146 萬；歐洲這一跳正正是「許可已放行的地區」的實證，境內中國出貨不受許可限制，是整套政策風險的對沖。(五) 匯率（本輪新增、上一版判斷錯漏）：Tongmei 撤回上交所科創板申請觸發十一家中國私募基金的贖回權，金額為人民幣 324,404,508 元（約 4,900 萬美元），8-K 明寫因贖回價以人民幣固定，應付的美元金額會隨人民幣兌美元匯率變動；另 Casela 的 2027 年供應合約亦以人民幣 1.73 億元定價（約 2,540 萬美元），即一塊已承諾的 2027 年收入是人民幣計價。加上全部生產在中國、成本以人民幣計，人民幣升值同時推高成本、推高贖回的美元負擔，但亦推高該張人民幣合約的美元收入——方向混合，幅度在贖回一項約 4,900 萬美元的本金基數上可量度。利率的傳導與一般製造業相反：2025 年 12 月約 1 億及 2026 年 4 月 6.325 億美元兩次增發後，2026Q2 淨利息收入由去年同期的淨支出 20.2 萬轉為收入 470 萬美元，而同季 GAAP 淨利潤只有 1,110 萬——即利率下行是直接削一塊已入帳的利潤，不是降低融資成本。"},"gaps":["本 packet 仍然沒有任何宏觀序列：沒有利率、孳息曲線、流動性、USD/CNY 匯率或經濟日曆，L1 紀律的「必用」宏觀指標序列與市場卡一項都沒有。以上宏觀判讀全部由公司申報的傳導描述推得，不能當作已量度的宏觀觀點。","沒有第三方終端需求資料：沒有 hyperscaler 資本開支、光模組出貨量、800G/1.6T 滲透率，亦沒有磷化銦或銦、鎵的價格序列。","政策狀態最新只到 2026-08-13 的 10-Q；沒有其後的許可批核統計、管制清單變動，亦沒有美國在 IEEPA 被推翻後實際採用的替代稅率。","人民幣暴露只有兩個點（約 4,900 萬美元贖回本金、人民幣 1.73 億元合約），沒有成本端的人民幣支出量級、沒有對沖政策披露，亦沒有匯率序列可以量度敏感度。"],"read_evidence_ids":["ev-d406ff03ccd3cc2ce517085af2acb59909bc648bb8dc469eef6cea9b27cf0c59","ev-88c91b6acd468693d8eee117acc303d0046be61a3fe009b83c070aa747707828","ev-da057b50d69e420efd46893165c49528c6336d3add9abe2adc43fb869ebad5a8","ev-1b221559ff7a9ee1588b00f6e6c73213b021e954236c8bae08a62b94ff506df2","ev-8d64828781ec65165f921defa5ed8ef6360aa44530f7236ab9fae6d91e83d7f9"],"strongest_counter":{"citations":[{"evidence_id":"ev-d406ff03ccd3cc2ce517085af2acb59909bc648bb8dc469eef6cea9b27cf0c59","locator":"L2442-L2444"},{"evidence_id":"ev-d406ff03ccd3cc2ce517085af2acb59909bc648bb8dc469eef6cea9b27cf0c59","locator":"L1841-L1845"},{"evidence_id":"ev-d406ff03ccd3cc2ce517085af2acb59909bc648bb8dc469eef6cea9b27cf0c59","locator":"L2450"}],"text":"最強替代解釋：宏觀順風是真的，但這家公司的宏觀暴露其實是「一個政策開關」而非一組可分散的變數，而開關的兩邊都不在公司手上。支持這個反面的證據：一、同一制度已經實證過一次破壞力——北美收入在不改變關稅金額的情況下由 8% 掉到 2%，2026Q2 更只剩 16.1 萬美元，而對美砷化鎵至今一張許可未批；二、公司自己把磷化銦許可稱為「目前最大的挑戰」，並明寫訂單與收入確認之間的錯配可能構成重大不利影響，即就算需求全對，收入的時點仍由審批決定；三、政策工具在兩邊都仍然打開（《對外貿易法》修訂、232／301 及可能的 122 條）。要公平講，這個反面不足以推翻論點的方向：歐洲收入一季之內由 160 萬升到 915 萬，說明放行正在發生，而北美既然已經接近零，剩下的多數是向上的期權而不是向下的風險；但它足以說明 L4 的收入情境要用「許可放行節奏」而不是「需求」作主要的分散來源。"}},"L2":{"assessed_at":"2026-09-16T12:11:05Z","assumptions":[{"citations":[{"evidence_id":"ev-4df1336efa2d7b08605cf29c3495f00e45609e0e58287ebf22fb7641a533ca09","locator":"L93"},{"evidence_id":"ev-50aa6aa19d63c97fb350531e141290f1be6e548f2ded03ac13208a0bb5ae72db","locator":"L99"},{"evidence_id":"ev-da057b50d69e420efd46893165c49528c6336d3add9abe2adc43fb869ebad5a8","locator":"L97"}],"text":"供給側（必答）：在持有期一個月至一年之內，有效供給追不上需求——這個結論本輪仍然成立，但改由合約條款支撐而不再靠管理層口述。Coherent 要求 AXT 承諾 2026 至 2028 年擴產、並以連續六個月達不到產能承諾作為對方的終止權；Lumentum 以六年期、每年最低承諾量加